{
  "eval_id": "eval-nbme-gen-004",
  "question_id": "nbme-gen-004",
  "evaluated_date": "2026-04-05",
  "evaluator_version": "nbme-evaluate-v1",
  "source_concepts_read": ["cocaine-induced-lung-toxicity", "diffuse-alveolar-hemorrhage"],
  "scores": {
    "A_stem": {
      "A1_cover_options": { "score": 10, "max": 10, "rationale": "The combination of a sympathomimetic toxidrome, fingertip burns, and diffuse pulmonary opacities in an acute setting leads directly to cocaine-induced lung toxicity without needing to see the options." },
      "A2_required_elements": { "score": 8, "max": 8, "rationale": "All elements present: Age (32), Sex (man), Symptom (dyspnea/cough), Objective finding (fingertip burns/CXR opacities).", "elements_present": ["age", "sex", "symptom", "objective_finding"] },
      "A3_clinical_authenticity": { "score": 6, "max": 6, "rationale": "Scenario is highly authentic; the fingertip burns are a classic clinical pearl for crack use." },
      "A4_information_density": { "score": 3, "max": 3, "rationale": "No extraneous information; all details contribute to the diagnosis or rule out mimics." },
      "A5_patient_characteristics": { "score": 3, "max": 3, "rationale": "Characteristics are appropriate and clinically relevant to the drug use pattern." },
      "section_total": 30,
      "section_max": 30
    },
    "B_lead_in": {
      "B1_single_question": { "score": 5, "max": 5, "rationale": "Lead-in is a single, clear question." },
      "B2_affirmative_phrasing": { "score": 3, "max": 3, "rationale": "Uses affirmative phrasing ('most likely')." },
      "B3_task_competency": { "score": 2, "max": 2, "rationale": "Matches 'most-likely-diagnosis' type." },
      "section_total": 10,
      "section_max": 10
    },
    "C_options": {
      "C1_five_options": { "score": 5, "max": 5, "rationale": "Exactly 5 options (A-E) are present." },
      "C2_grammatical_parallel": { "score": 5, "max": 5, "rationale": "All options are noun phrases (diagnoses)." },
      "C3_homogeneous": { "score": 5, "max": 5, "rationale": "All options are pulmonary diagnoses." },
      "C4_no_all_none": { "score": 3, "max": 3, "rationale": "No 'all/none of the above' options." },
      "C5_distractor_plausibility": { "score": 6, "max": 7, "rationale": "Distractors are plausible mimics of acute hypoxemia/opacities, though pulmonary fibrosis is slightly less plausible in an acute onset scenario (but still a valid differential for opacities)." },
      "C6_unambiguous_correct": { "score": 5, "max": 5, "rationale": "Correct answer is definitively supported by the clinical clues." },
      "section_total": 29,
      "section_max": 30
    },
    "D_technical_flaws": {
      "D1_long_correct_option": { "pass": true, "rationale": "Option B is slightly longer but not significantly so compared to A." },
      "D2_absolute_terms": { "pass": true, "rationale": "No absolute terms used in distractors." },
      "D3_grammatical_clue": { "pass": true, "rationale": "No grammatical cues leading to the answer." },
      "D4_clang_repetition": { "pass": true, "rationale": "No key words repeated only in the correct option." },
      "D5_convergence": { "pass": true, "rationale": "No convergence strategy used." },
      "D6_collectively_exhaustive": { "pass": true, "rationale": "No exhaustive pairs." },
      "D7_vague_qualifiers": { "pass": true, "rationale": "No vague qualifiers." },
      "D8_nonparallel": { "pass": true, "rationale": "Options are parallel." },
      "D9_correct_stands_out": { "pass": true, "rationale": "Correct option does not stand out visually." },
      "D10_tricky_stem": { "pass": true, "rationale": "Stem is clear and clinically direct." },
      "flaws_found": [],
      "deductions": 0,
      "section_total": 20,
      "section_max": 20
    },
    "E_explanation": {
      "E1_correct_rationale": { "score": 4, "max": 4, "rationale": "Correct answer is well-explained via clinical clues." },
      "E2_distractor_rationale": { "score": 4, "max": 4, "rationale": "All distractors are addressed specifically." },
      "E3_teaching_point": { "score": 2, "max": 2, "rationale": "High-yield, one-sentence takeaway that differs from the explanation start." },
      "section_total": 10,
      "section_max": 10
    }
  },
  "total_score": 99,
  "total_max": 100,
  "tier": "A — Publication-ready",
  "flaws_found": [],
  "recommendations": [
    "The question is of exceptionally high quality. No critical changes needed. A minor refinement could be to replace 'Pulmonary fibrosis' with something slightly more acute (e.g., ARDS) to increase distractor plausibility, but as a test of the specific 'crack lung' pattern, the current set is sufficient."
  ],
  "rewrite": {
    "question_id": "nbme-gen-004",
    "generated_date": "2026-04-05",
    "source_concepts": ["cocaine-induced-lung-toxicity"],
    "source_uworld": "20900",
    "system": "Pulmonary & Critical Care",
    "topic": "Cocaine-Induced Lung Toxicity",
    "subtopic": "Diagnosis",
    "difficulty": "medium",
    "question_type": "most-likely-diagnosis",
    "stem": "A 32-year-old man is brought to the emergency department by his roommate for acute onset of severe dyspnea and cough. On physical examination, he is restless and tachycardic with a blood pressure of 165/95 mmHg. Multiple small, circular burns are noted on the tips of his fingers. Lung auscultation reveals diffuse inspiratory crackles, and pulse oximetry shows an oxygen saturation of 84% on room air. Chest radiography demonstrates diffuse bilateral airspace opacities with a normal cardiomediastinal silhouette.",
    "lead_in": "Which of the following is the most likely diagnosis?",
    "options": {
      "A": "Acute cardiogenic pulmonary edema",
      "B": "Cocaine-induced diffuse alveolar hemorrhage",
      "C": "Pulmonary embolism",
      "D": "Acute respiratory distress syndrome",
      "E": "Viral pneumonitis"
    },
    "correct_answer": "B",
    "explanation": "The patient presents with a sympathomimetic toxidrome (tachycardia, hypertension, restlessness) and signs of acute lung injury. The presence of fingertip burns is a highly specific finding for the use of hot pipes to inhale cocaine (crack). Diffuse bilateral opacities on chest X-ray with a normal heart size distinguish this from cardiogenic pulmonary edema. The constellation of recent cocaine use, acute hypoxemia, and ground-glass opacities is characteristic of cocaine-induced diffuse alveolar hemorrhage (DAH). Pulmonary embolism typically presents with clear lungs on X-ray, and ARDS typically occurs in the setting of a systemic trigger (e.g., sepsis) and does not present with sympathomimetic signs or fingertip burns.",
    "teaching_point": "Cocaine-induced lung toxicity presents as diffuse alveolar hemorrhage, often signaled by a sympathomimetic toxidrome and characteristic fingertip burns from hot-pipe inhalation.",
    "distractor_rationale": {
      "A": "Incorrect: The normal cardiomediastinal silhouette and sympathomimetic state make cardiogenic edema less likely.",
      "B": "Correct: Classic presentation of crack-induced DAH.",
      "C": "Incorrect: PE usually shows clear lungs on CXR, not diffuse airspace opacities.",
      "D": "Incorrect: ARDS lacks the specific fingertip burns and sympathomimetic toxidrome.",
      "E": "Incorrect: While viral pneumonia causes opacities, it lacks the specific sympathomimetic and fingertip burn findings."
    },
    "tags": ["step2", "pulmonary", "cocaine", "dah"],
    "review_status": "reviewed",
    "reviewer_notes": "Rewritten by nbme-evaluate. Original score: 99/100. Projected: 100/100. Updated distractor D (Fibrosis -> ARDS) for better acute-phase plausibility."
  },
  "rewrite_projected_score": 100,
  "rewrite_changes_summary": "The original item was already near-perfect. The only change made was replacing 'Pulmonary fibrosis' (a chronic process) with 'Acute respiratory distress syndrome' (an acute process) in the options to ensure all distractors were perfectly plausible in the context of a sudden onset of dyspnea."
}